{
  "schema_version": "1.0.0",
  "response_id": "response-doubao-category-001",
  "request_id": "request-doubao-category-001",
  "protocol_id": "protocol-example-education",
  "query_id": "q-category",
  "consumer_product": "doubao",
  "provider": "volcengine",
  "channel": "official_api",
  "status": "completed",
  "collected_at": "2026-08-20T18:00:03+08:00",
  "model_requested": "doubao-seed-2-0-lite-260215",
  "model_reported": "doubao-seed-2-0-lite-260215",
  "search_requested": true,
  "search_executed": true,
  "citation_mode": "structured",
  "raw_text": "示例回答仅用于验证采集契约，不代表任何平台真实输出",
  "citations": [
    {"url": "https://example.com/reference", "title": "示例来源"}
  ],
  "raw_payload": {"fixture": true},
  "request_fingerprint": "555cd0228ad9b6f1ca7c1ef0cbc4605d198be0a2951a1ad3bf8f1d5570e6d7d8",
  "platform_request_id": "fixture-platform-request-001",
  "screenshot_path": null,
  "error": null
}
